data,fonte,titolo,link
17/03/2022,La Provincia Pavese, Emergenza Ucraina ecco UkraineHelpIT: una piattaforma che raccoglie e verifica info utili a chi fugge o chi vuole aiutare,https://laprovinciapavese.gelocal.it/pavia/cronaca/2022/03/17/news/emergenza-ucraina-ecco-ukrainehelpit-una-piattaforma-che-raccoglie-e-verifica-info-utili-a-chi-fugge-o-chi-vuole-aiutare-1.41308190
17/03/2022,ActionAid International Italia Onlus, 17 marzo. Online UkraineHelpIT servizio informazioni in tempo reale,https://www.actionaid.it/informati/notizie/solidarieta-alla-popolazione-ucraina
17/03/2022,Italia24.org, Progetto “UkraineHelpIT”: servizio in tempo reale per aiutare l’Ukraine,https://italia24.org/progetto-ukrainehelpit-servizio-in-tempo-reale-per-aiutare-lucraina/?fbclid=IwAR12RXW6fsHuDL8-Ap4noMgbI3CZGcFR6QI3NF8MrLral0U6CEACZtIwWiI
17/03/2022,Il Capoluogo d'Abruzzo, Ucraina, nasce la piattaforma per la mappatura delle iniziative di solidarietà,https://www.ilcapoluogo.it/2022/03/17/ucraina-nasce-la-piattaforma-per-la-mappatura-delle-iniziative-di-solidarieta/?fbclid=IwAR12RXW6fsHuDL8-Ap4noMgbI3CZGcFR6QI3NF8MrLral0U6CEACZtIwWiI
17/03/2022,SeiTV, Guerra in Ucraina: nasce la piattaforma per mappare le iniziative solidali,https://www.seitv.it/2022/03/17/guerra-in-ucraina-in-campania-nasce-la-piattaforma-per-mappare-le-iniziative-solidali/
17/03/2022,NewTuscia.it, Progetto “UkraineHelpIT”: servizio in tempo reale per aiutare l’Ucraina,https://www.newtuscia.it/2022/03/17/progetto-ukrainehelpit-servizio-in-tempo-reale-per-aiutare-lucraina/
